{
  "$schema": "http://json-schema.org/draft-07/schema#",
  "title": "ZAP Mission Envelope (v0.1)",
  "type": "object",
  "additionalProperties": false,
  "required": [
    "zap",
    "type",
    "id",
    "ts",
    "missionId",
    "agent",
    "goal",
    "budget",
    "policy",
    "steps"
  ],
  "properties": {
    "zap": {
      "type": "string",
      "enum": [
        "0.1"
      ],
      "description": "ZAP protocol version (0.1 = the v0 slice of issue #809)"
    },
    "type": {
      "type": "string",
      "enum": [
        "mission"
      ]
    },
    "id": {
      "type": "string",
      "minLength": 1,
      "description": "Unique message id (host: UUID v4)"
    },
    "ts": {
      "type": "string",
      "pattern": "^\\d{4}-\\d{2}-\\d{2}T\\d{2}:\\d{2}:\\d{2}(\\.\\d+)?Z$",
      "description": "ISO-8601 UTC with Z suffix"
    },
    "missionId": {
      "type": "string",
      "minLength": 1,
      "description": "Session key; later missions with the same id CONTINUE the session"
    },
    "agent": {
      "type": "string",
      "minLength": 1,
      "description": "Who is asking (framework name)"
    },
    "goal": {
      "type": "string",
      "minLength": 1,
      "description": "Human-readable intent"
    },
    "feature": {
      "type": "string",
      "minLength": 1,
      "description": "Optional zuraffa feature slug"
    },
    "budget": {
      "type": "object",
      "additionalProperties": false,
      "required": [
        "maxSteps"
      ],
      "properties": {
        "maxSteps": {
          "type": "integer",
          "minimum": 1,
          "description": "Session step budget; FIXED by the first mission (self-escalation is rejected)"
        }
      }
    },
    "policy": {
      "type": "object",
      "additionalProperties": false,
      "required": [
        "riskTier"
      ],
      "properties": {
        "riskTier": {
          "type": "string",
          "enum": [
            "standard",
            "elevated",
            "admin"
          ]
        },
        "toolAllowlist": {
          "type": "array",
          "minItems": 1,
          "uniqueItems": true,
          "items": {
            "type": "string",
            "minLength": 1,
            "description": "Allowed executable (first token of each step command)"
          }
        }
      }
    },
    "steps": {
      "type": "array",
      "minItems": 1,
      "description": "Work requested; executed in order without a shell",
      "items": {
        "type": "object",
        "additionalProperties": false,
        "required": [
          "id",
          "command",
          "phase"
        ],
        "properties": {
          "id": {
            "type": "string",
            "minLength": 1
          },
          "command": {
            "type": "string",
            "minLength": 1,
            "description": "Whitespace-tokenized; first token must be in the session allowlist"
          },
          "description": {
            "type": "string"
          },
          "phase": {
            "type": "string",
            "enum": [
              "red",
              "green",
              "refactor",
              "verify"
            ]
          },
          "timeoutSeconds": {
            "type": "integer",
            "minimum": 1,
            "maximum": 600
          }
        }
      }
    }
  }
}
