{
  "zap": "0.1",
  "type": "mission",
  "id": "m-demo-0001",
  "ts": "2026-09-03T10:00:00Z",
  "missionId": "demo-tdd",
  "agent": "foreign-client",
  "goal": "Drive a full TDD loop",
  "feature": "071-zuraffa-agent-protocol",
  "budget": {
    "maxSteps": 8
  },
  "policy": {
    "riskTier": "standard",
    "toolAllowlist": [
      "dart"
    ]
  },
  "steps": [
    {
      "id": "s1",
      "command": "dart examples/zap_demo/tdd_loop.dart red",
      "phase": "red",
      "description": "witness the failing check",
      "timeoutSeconds": 30
    },
    {
      "id": "s2",
      "command": "dart examples/zap_demo/tdd_loop.dart green",
      "phase": "green",
      "description": "the fixed check passes"
    }
  ]
}
